{
  "$schema": "./schema.json",
  "version": 1,
  "id": "517-desktop-roster-routing",
  "summary": {
    "en": "Bound Desktop sessions look up live project members by public GitHub login and route ask_user_question to that colleague.",
    "zh": "已绑定的 Desktop 会话按公开 GitHub 登录名查找实时项目成员，并将 ask_user_question 定向给该同事。"
  },
  "releases": {
    "desktop": "minor",
    "mobile": "none",
    "platform": "none"
  },
  "compatibilityExceptions": [
    {
      "releaseUnit": "mobile",
      "reason": "Mobile does not compose the Desktop loopback membership projection, Web Host rosterResolver, or bound-session ask_user_question routing added by this delivery."
    },
    {
      "releaseUnit": "platform",
      "reason": "Platform does not compose the Desktop agent runtime or Web Host desktopProjectMembership bridge, and this delivery changes no Platform image or deployment input."
    }
  ]
}
