{
  "$schema": "./schema.json",
  "version": 1,
  "id": "345-assembled-project-members",
  "summary": {
    "en": "Complete encrypted member-question routing between Desktop installations with transferred reference documents and lifecycle outcomes.",
    "zh": "完成桌面安装之间的加密成员提问路由，并传输参考文档与终态结果。"
  },
  "releases": {
    "desktop": "minor",
    "mobile": "none",
    "platform": "none"
  },
  "compatibilityExceptions": [
    {
      "releaseUnit": "mobile",
      "reason": "Mobile does not compose the Desktop Host member-question sender, receiver, or Project Membership UI changed by this delivery."
    },
    {
      "releaseUnit": "platform",
      "reason": "The Platform application neither decrypts nor retains member-question content, and this delivery changes no apps/platform or deployment input."
    }
  ]
}
