{
  "$schema": "./schema.json",
  "version": 1,
  "id": "519-invite-role-picker",
  "summary": {
    "en": "Let eligible inviters choose the Project role granted when an invitation is accepted.",
    "zh": "让符合条件的邀请人选择接受邀请时授予的项目角色。"
  },
  "releases": {
    "desktop": "minor",
    "mobile": "none",
    "platform": "minor"
  },
  "compatibilityExceptions": [
    {
      "releaseUnit": "mobile",
      "reason": "Mobile does not compose Workspace settings, the invite wizard, or Project Membership HTTP routes changed by this delivery."
    }
  ]
}
